{
  "schema_version": "0.1.0",
  "id": "jscpd-json",
  "tool": {
    "name": "jscpd",
    "url": "https://github.com/kucherenko/jscpd"
  },
  "family": "duplication",
  "output_kind": "duplication",
  "license": {
    "id": "MIT",
    "status": "needs_review"
  },
  "execution": {
    "mode": "local-command",
    "network": "none",
    "mutates_target": false,
    "reads": ["target source tree"],
    "writes": ["tool-outputs/jscpd-report.json"]
  },
  "privacy": {
    "contains_source_snippets": true,
    "contains_secret_values": false,
    "redaction_required": true
  },
  "evidence": {
    "default_state": "metadata-visible",
    "source": "local jscpd JSON output",
    "limitations": ["near-clone thresholds depend on jscpd configuration"]
  },
  "commands": [
    {
      "label": "jscpd json report",
      "executable": "jscpd",
      "args": ["--reporters", "json", "--output", "<tool-output-dir>", "<target-root>"],
      "output_path": "<tool-output-dir>/jscpd-report.json"
    }
  ],
  "limitations": [
    "May include source fragments depending on reporter configuration",
    "Does not prove component-level duplication without SBOM evidence"
  ]
}
